Sentence,Response,sent_meant,gt
Return the XYZ to the operator following the ABC routine to verify proper functioning and safety.,ऑपरेटरला योग्यरित्या कार्य करण्यासाठी आणि सुरक्षितता सुनिश्चित करण्यासाठी एबीसी रूटीनचे पालन करून एक्सवायझेड परत करा.,"Return the XYZ to the operator, following the ABC routine to verify proper functioning and safety.",योग्य कार्यप्रणाली आणि सुरक्षितता सत्यापित करण्यासाठी 'एबीसी' नियमांचे पालन करून 'XYZ' ऑपरेटरला परत करा.
Insert the new disk into the disk drive with the notch at the bottom facing the drive’s entry slot.,नवीन डिस्क ड्राइव्हच्या तळाशी असलेल्या नॉचला ड्राइव स्लॉटमध्ये घालावे.,"Insert the new disk into the disk drive, with the notch at the bottom facing the drive’s entry slot.","नवीन डिस्क डिस्क ड्राइव्हमध्ये घाला, ज्याचा तळाशी असलेला नॉच ड्राइव्हच्या प्रवेश स्लॉटकडे तोंड करून असेल."
"Replace the fuel lines and electrical conduits, which have cracks or damaged B-nut fittings to prevent leaks and ensure safe operation.","फ्युएल लाईन्स आणि इलेक्ट्रिकल कंड्यूट्सची पुनर्स्थापना करा, जे खराब झालेले बी-नट फिटिंग्समुळे गळती रोखण्यासाठी आणि सुरक्षित ऑपरेशन सुनिश्चित करण्यासाठी आहेत.",Replace the fuel lines and electrical conduits which have cracks or damaged B-nut fittings to prevent leaks and ensure safe operation.,"ज्या इंधन लाईन्स आणि इलेक्ट्रिकल कंड्युईट्सना तडे गेले आहेत किंवा बी-नट फिटिंग्ज खराब झाली आहेत, त्यांना गळती टाळण्यासाठी आणि सुरक्षित कामकाज सुनिश्चित करण्यासाठी बदला."
The processor accepts data from input devices and checks it before computing to ensure accuracy and prevent errors.,"प्रोसेसर इनपुट डिव्हाइसमधून डेटा स्वीकारतो आणि अचूकता सुनिश्चित करण्यासाठी त्याची पडताळणी करतो, ज्यामुळे त्रुटी टाळण्यास मदत होते.","The processor accepts data from input devices, and checks it before computing to ensure accuracy and prevent errors.",प्रोसेसर इनपुट उपकरणांकडून डेटा स्वीकारतो आणि अचूकता सुनिश्चित करण्यासाठी व त्रुटी टाळण्यासाठी तो गणनेपूर्वी तपासतो.
"The orifice through which the exhaust gases leave the chamber, is larger than the intake valve opening.",कक्षातून बाहेर पडणाऱ्या वायूचा मार्ग मोठा असतो तर आत येणार्‍या वाफांचा मार्ग लहान असतो.,"The orifice, through which the exhaust gases leave the chamber is larger than the intake valve opening.","ज्या मुखातून उत्सर्जक वायू कक्षातून बाहेर पडतात, ते इनटेक व्हॉल्व्हच्या उघडण्यापेक्षा मोठे आहे."
Take no action as the camera operates automatically under all lighting conditions.,"इंग्रजी इनपुटः कॅमेरा स्वयंचलितपणे सर्व प्रकाश परिस्थितींमध्ये कार्य करतो, त्यामुळे कोणतेही कृती आवश्यक नाही.","Take no action, as the camera operates automatically under all lighting conditions.","कोणतीही कार्यवाही करू नका, कारण कॅमेरा सर्व प्रकाश परिस्थितीत आपोआप कार्य करतो."
The species of fish supported by the reef are varied and abundant food supplies are available to sustain their populations.,मत्स्य प्रजानां विविधता आणि विपुल अन्नसामग्रीमुळे त्यांच्या लोकसंख्येला आधार मिळतो.,"The species of fish supported by the reef are varied, and abundant food supplies are available to sustain their populations.",रीफमुळे आधारलेल्या माशांच्या प्रजाती वैविध्यपूर्ण आहेत आणि त्यांच्या लोकसंख्या टिकवून ठेवण्यासाठी भरपूर अन्न पुरवठा उपलब्ध आहे.
"At high temperatures, all the ceramic materials show ductility and hardness decreases considerably, leading to a higher risk of deformation under load.",उच्च तापमानात सर्व सिरेमिक सामग्री लवचिकता आणि कडकपणा कमी दर्शवते ज्यामुळे भार अंतर्गत विकृतीचा धोका वाढतो.,"At high temperatures, all the ceramic materials show ductility, and hardness decreases considerably, leading to a higher risk of deformation under load.","उच्च तापमानावर, सर्व सिरामिक साहित्ये तन्यता दर्शवतात आणि कडकपणा मोठ्या प्रमाणात कमी होतो, ज्यामुळे भाराखाली विरूपणाचा धोका वाढतो."
"This produces hard copy that can be retained but printed sheets are bulky to handle, so digital storage and viewing are often preferred.",हे इंग्रजी हार्ड कॉपी तयार करते जी जतन केली जाऊ शकते परंतु छापलेली पृष्ठे हाताळण्यास कठीण असतात म्हणून डिजिटल साठवणूक आणि पाहणे अनेकदा पसंत केले जाते.,"This produces hard copy that can be retained, but printed sheets are bulky to handle, so digital storage and viewing are often preferred.","यामुळे जतन करता येणारी हार्ड कॉपी तयार होते, पण छापलेली पाने हाताळण्यास जाडजूड असल्याने, डिजिटल साठवण आणि पाहण्याला अनेकदा प्राधान्य दिले जाते."
Connection to PTT-supplied packet-switch networks will be a prime requirement of the workstation and gateways into these networks are planned by the PTTs to ensure seamless data communication.,कार्यस्थळ आणि गेटवेच्या माध्यमातून पाकिट स्विच नेटवर्कशी जोडणी करणे हे कामाचे प्राथमिक कार्य असेल असे नियोजन करण्यात आले आहे.,"Connection to PTT-supplied packet-switch networks will be a prime requirement of the workstation, and gateways into these networks are planned by the PTTs to ensure seamless data communication.",पीटीटीने पुरवलेल्या पॅकेट-स्विच नेटवर्कशी जोडणी ही वर्कस्टेशनची प्रमुख आवश्यकता असेल आणि अखंड डेटा संवाद सुनिश्चित करण्यासाठी या नेटवर्कमध्ये प्रवेशासाठी गेटवे पीटीटीद्वारे नियोजित आहेत.
The system consistently achieved 50 gallons per hour optimum output.,प्रणालीने सातत्याने ५० गॅलन प्रति तास सर्वोत्तम उत्पादन साध्य केले आहे.,The system consistently achieved 50 gallons per hour — optimum output.,प्रणालीने सातत्याने दर तासाला ५० गॅलन – इष्टतम उत्पादन – गाठले.
percentage reduction is critical: over and under reduction cause the ink to be very uneven and prone to smudging.,प्रतिशत कमी करणे हे महत्त्वाचे आहेः ओव्हर आणि अंडर रिडक्शनमुळे इंक खूप असमान होते आणि धुळीस मिळते.,percentage reduction is critical: over- and underreduction cause the ink to be very uneven and prone to smudging.,टक्केवारीतील घट निर्णायक आहे: जास्त घट आणि कमी घट यांमुळे शाई खूपच असमान होते आणि सहज डाग पडण्याची शक्यता असते.
Adopting a user-centered approach is a realistic strategy in the design of both paper and screen based forms.,कागदावर आणि पडद्यावर दोन्ही ठिकाणी वापरकर्ते केंद्रित दृष्टिकोन हा व्यवहार्य धोरण आहे.,Adopting a user-centered approach is a realistic strategy in the design of both paper- and screen-based forms.,"वापरकर्ता-केंद्रित दृष्टिकोन स्वीकारणे, कागदावर आधारित आणि स्क्रीनवर आधारित असलेल्या दोन्ही फॉर्म्सच्या डिझाइनमध्ये एक वास्तववादी रणनीती आहे."
Morphological studies of paraquat or oxygen toxicity in rats have shown significant cellular damage in lung tissue.,,Morphological studies of paraquat- or oxygen-toxicity in rats have shown significant cellular damage in lung tissue.,उंदरांमधील पॅराक्वेट किंवा ऑक्सिजन विषारीपणाच्या रूपात्मक अभ्यासांनी फुफ्फुसाच्या ऊतीमध्ये लक्षणीय पेशींचे नुकसान दर्शविले आहे.
One should read G. V. Carey’s chapter Proof Correction in Mind the Stop.,एकवेळा वाचा ग. व्ही. केरीचे मनथ थांबवा या अध्यायातील पुरावा दुरुस्ती.,One should read G. V. Carey’s chapter ‘Proof Correction’ in Mind the Stop.,जी. व्ही. कॅरीचा 'माईंड द स्टॉप' मधील 'प्रूफ करेक्शन' हा अध्याय वाचला पाहिजे.
"The glass content of this material is low, 10% by weight, for this application.","या सामग्रीचे काच प्रमाण कमी आहे, १० टक्के वजनाने, ह्या अनुप्रयोगासाठी.","The glass content of this material is low, (10% by weight), for this application.",या सामग्रीतील काचेचे प्रमाण (वजनानुसार १०%) या उपयोगासाठी कमी आहे.
"During the experiment, the animals will be fed with water, via an automatic system, ad libitum.","प्रयोगादरम्यान प्राण्यांना पाणी मिळेल, स्वयंचलित प्रणालीद्वारे, अमर्यादपणे.","During the experiment, the animals will be fed with water, (via an automatic system), ad libitum.","प्रयोगादरम्यान, प्राण्यांना पाणी (स्वयंचलित प्रणालीद्वारे) इच्छेनुसार दिले जाईल."
a water:glycol ratio of 60:40 is preferred.,"पाण्याचा ग्लायकोलाइड गुणोत्तर ६० : ४० आहे, ते पसंत केले जाते.",a water/glycol ratio of 60/40 is preferred.,६०/४० पाण्याचे/ग्लायकॉलचे प्रमाण पसंत केले जाते.
It has thickness of only 16:240 inch.,ते केवळ १६ इंच जाड आहे.,It has thickness of only 16/240 inch.,त्याची जाडी फक्त १६/२४० इंच आहे.
